{
  "schema_version": "6.2.0",
  "state_revision": 2,
  "project_id": "seq_observed_deviation",
  "project_mode": "sequence_project",
  "surface": {"name": "unknown", "profile": "conservative_generic", "verified_at": null},
  "clip_budget_sec": null,
  "prompt_budget": null,
  "story": {
    "logline": "A courier unlocks a rooftop case before a signal flare.",
    "story_promise": "A guarded delivery reveals a signal device.",
    "objective": "Get the courier to the case and reveal the device.",
    "initial_condition": "Courier reaches a rooftop door.",
    "final_outcome": "The signal device lights safely inside the open case.",
    "target_duration_sec": 30,
    "tone": "precise suspense",
    "medium": "live_action"
  },
  "world_bible": {"location": "wet rooftop service area"},
  "reference_registry": [{"tag": "[Image1]", "role": "courier identity", "preserve_exact_tag": true}],
  "beats": [
    {"beat_id": "beat_unlock_case", "description": "Courier unlocks the case.", "narrative_function": "access", "status": "completed", "assigned_clip_id": "clip_01", "dependencies": []},
    {"beat_id": "beat_open_case", "description": "Courier opens the case.", "narrative_function": "reveal setup", "status": "completed", "assigned_clip_id": "clip_01", "dependencies": ["beat_unlock_case"]},
    {"beat_id": "beat_signal_lights", "description": "Signal device lights inside the case.", "narrative_function": "payoff", "status": "current", "assigned_clip_id": "clip_02", "dependencies": ["beat_open_case"]}
  ],
  "clips": [
    {
      "clip_id": "clip_01",
      "parent_clip_id": null,
      "sequence_index": 1,
      "prompt_version": "6.2.0",
      "generation_mode": "I2V",
      "source_clip_tag": null,
      "status": "accepted_with_deviation",
      "narrative_job": "Unlock the rooftop case.",
      "already_happened": [],
      "this_clip_only": ["beat_unlock_case"],
      "reserved_for_later": ["beat_open_case", "beat_signal_lights"],
      "planned_start_state": {"location": "wet rooftop service area", "reference_tags": ["[Image1]"], "prop_owner": "courier"},
      "planned_end_state": {"location": "wet rooftop service area", "reference_tags": ["[Image1]"], "prop_owner": "courier"},
      "observed_start_state": {"location": "wet rooftop service area", "reference_tags": ["[Image1]"], "prop_owner": "courier"},
      "observed_end_state": {"location": "wet rooftop service area", "reference_tags": ["[Image1]"], "prop_owner": "courier", "pose": "crouched at open case", "motion_vector": "hand lifting away from latch"},
      "continuity_locks": ["courier identity", "case identity", "reference_tags"],
      "allowed_changes": ["case opened earlier than planned"],
      "continuity_breaks": [],
      "accepted_deviations": ["case opened one clip early"],
      "transition_in": "first clip",
      "transition_out": "open case visible",
      "open_motion_vectors": ["hand lifting away from latch"],
      "handoff_requirements": ["do not repeat unlocking or opening case"],
      "extension_depth": 0
    },
    {
      "clip_id": "clip_02",
      "parent_clip_id": "clip_01",
      "sequence_index": 2,
      "prompt_version": "6.2.0",
      "generation_mode": "V2V",
      "source_clip_tag": "[Video1]",
      "status": "ready",
      "narrative_job": "Light the already visible signal device.",
      "already_happened": ["beat_unlock_case", "beat_open_case"],
      "this_clip_only": ["beat_signal_lights"],
      "reserved_for_later": [],
      "planned_start_state": {"location": "wet rooftop service area", "reference_tags": ["[Image1]"], "prop_owner": "courier", "pose": "crouched at open case", "motion_vector": "hand lifting away from latch"},
      "planned_end_state": {"location": "wet rooftop service area", "reference_tags": ["[Image1]"], "prop_owner": "courier", "pose": "watching lit signal device", "motion_vector": "signal pulse stabilizes"},
      "observed_start_state": null,
      "observed_end_state": null,
      "continuity_locks": ["courier identity", "case identity", "reference_tags"],
      "allowed_changes": ["signal light may activate"],
      "continuity_breaks": [],
      "accepted_deviations": [],
      "transition_in": "intentional next shot from open case",
      "transition_out": "signal lit",
      "open_motion_vectors": ["signal pulse stabilizes"],
      "handoff_requirements": ["do not repeat unlocking", "do not repeat opening"],
      "extension_depth": 1
    }
  ],
  "take_history": [{"take_id": "take_clip01_b", "clip_id": "clip_01", "verdict": "accept_with_deviation"}],
  "current_clip_id": "clip_02",
  "canon_revision": 2,
  "updated_at": "2026-06-20"
}
